{
  "breakthrough_candidates": [
    "agent",
    "agents",
    "model",
    "verification"
  ],
  "domain": "atrahasis_invention_intelligence",
  "frontier_signals": [
    {
      "domain": "agent",
      "evidence_signal": 3,
      "momentum": 0.82
    },
    {
      "domain": "agents",
      "evidence_signal": 4,
      "momentum": 0.74
    },
    {
      "domain": "model",
      "evidence_signal": 5,
      "momentum": 0.66
    },
    {
      "domain": "verification",
      "evidence_signal": 6,
      "momentum": 0.58
    },
    {
      "domain": "detection",
      "evidence_signal": 7,
      "momentum": 0.5
    },
    {
      "domain": "system",
      "evidence_signal": 8,
      "momentum": 0.42
    },
    {
      "domain": "governance",
      "evidence_signal": 9,
      "momentum": 0.34
    },
    {
      "domain": "epoch",
      "evidence_signal": 10,
      "momentum": 0.26
    }
  ],
  "maturity_estimates": [
    {
      "cluster": "specification",
      "maturity": "active"
    },
    {
      "cluster": "prior_art",
      "maturity": "active"
    }
  ],
  "type": "TECHNOLOGY_FRONTIER_MODEL"
}
